<?xml version="1.0"?>
<!--
/**
 * @category  Scandiweb
 * @package   Scandiweb_ContentTypes
 * @copyright Copyright (c) 2025 Scandiweb, Inc (https://scandiweb.com)
 * @license   http://opensource.org/licenses/OSL-3.0 The Open Software License 3.0 (OSL-3.0)
 */
-->
<config xmlns:xsi="http://www.w3.org/2001/XMLSchema-instance" xsi:noNamespaceSchemaLocation="urn:magento:module:Magento_PageBuilder:etc/content_type.xsd">
    <type name="slider" icon="" label="Slider" component="Magento_PageBuilder/js/content-type-collection" preview_component="Magento_PageBuilder/js/content-type/slider/preview" master_component="Magento_PageBuilder/js/content-type/master-collection" form="pagebuilder_scandiweb_slider_form" menu_section="scandiweb_components" sortOrder="41" translate="label">
        <breakpoints>
            <breakpoint name="mobile">
                <form>pagebuilder_scandiweb_slider_mobile_form</form>
            </breakpoint>
        </breakpoints>
        <children default_policy="deny">
            <child name="slide" policy="allow"/>
        </children>
        <appearances>
            <appearance default="true" name="default" preview_template="Magento_PageBuilder/content-type/slider/default/preview" master_template="Magento_PageBuilder/content-type/slider/default/master" reader="Magento_PageBuilder/js/master-format/read/configurable">
                <elements>
                    <element name="main">
                        <style name="text_align" source="text_align"/>
                        <style name="min_height" source="min_height" converter="Magento_PageBuilder/js/converter/style/min-height"/>
                        <style name="border" source="border_style" converter="Magento_PageBuilder/js/converter/style/border-style"/>
                        <style name="border_color" source="border_color"/>
                        <style name="border_width" source="border_width" converter="Magento_PageBuilder/js/converter/style/border-width"/>
                        <style name="border_radius" source="border_radius" converter="Magento_PageBuilder/js/converter/style/remove-px"/>
                        <style name="display" source="display" converter="Magento_PageBuilder/js/converter/style/display" preview_converter="Magento_PageBuilder/js/converter/style/preview/display"/>
                        <style name="margins" storage_key="margins_and_padding" reader="Magento_PageBuilder/js/property/margins" converter="Magento_PageBuilder/js/converter/style/margins"/>
                        <style name="padding" storage_key="margins_and_padding" reader="Magento_PageBuilder/js/property/paddings" converter="Magento_PageBuilder/js/converter/style/paddings"/>
                        <attribute name="name" source="data-content-type"/>
                        <attribute name="appearance" source="data-appearance"/>
                        <attribute name="autoplay" source="data-autoplay"/>
                        <attribute name="autoplay_speed" source="data-autoplay-speed"/>
                        <attribute name="fade" source="data-fade"/>
                        <attribute name="is_infinite" source="data-infinite-loop"/>
                        <attribute name="show_arrows" source="data-show-arrows"/>
                        <attribute name="show_dots" source="data-show-dots"/>
                        <css name="css_classes"/>
                    </element>
                </elements>
            </appearance>
        </appearances>
    </type>
</config>