<?xml version="1.0"?>
<!--
/**
 * @category  Scandiweb
 * @package   Scandiweb_ContentTypes
 * @copyright Copyright (c) 2025 Scandiweb, Inc (https://scandiweb.com)
 * @license   http://opensource.org/licenses/OSL-3.0 The Open Software License 3.0 (OSL-3.0)
 */
-->
<config xmlns:xsi="http://www.w3.org/2001/XMLSchema-instance" xsi:noNamespaceSchemaLocation="urn:magento:module:Magento_PageBuilder:etc/content_type.xsd">
    <type name="read_more_text" label="Read more Text" component="Magento_PageBuilder/js/content-type" preview_component="Magento_PageBuilder/js/content-type/text/preview" form="pagebuilder_scandiweb_read_more_text_form" menu_section="scandiweb_elements" sortOrder="2" translate="label">
        <children default_policy="deny"/>
        <appearances>
            <appearance default="true" name="default" preview_template="Magento_PageBuilder/content-type/text/default/preview" master_template="Scandiweb_ContentTypes/content-type/read-more-text/default/master" reader="Magento_PageBuilder/js/master-format/read/configurable">
                <elements>
                    <element name="main">
                        <style name="text_align" source="text_align"/>
                        <style name="border" source="border_style" converter="Magento_PageBuilder/js/converter/style/border-style"/>
                        <style name="border_color" source="border_color"/>
                        <style name="border_width" source="border_width" converter="Magento_PageBuilder/js/converter/style/border-width"/>
                        <style name="border_radius" source="border_radius" converter="Magento_PageBuilder/js/converter/style/remove-px"/>
                        <style name="display" source="display" converter="Magento_PageBuilder/js/converter/style/display" preview_converter="Magento_PageBuilder/js/converter/style/preview/display"/>
                        <style name="margins" storage_key="margins_and_padding" reader="Magento_PageBuilder/js/property/margins" converter="Magento_PageBuilder/js/converter/style/margins"/>
                        <style name="padding" storage_key="margins_and_padding" reader="Magento_PageBuilder/js/property/paddings" converter="Magento_PageBuilder/js/converter/style/paddings"/>
                        <attribute name="name" source="data-content-type"/>
                        <attribute name="appearance" source="data-appearance"/>
                        <attribute name="truncate_desktop" source="truncate_desktop"/>
                        <attribute name="truncate_desktop_lines" source="truncate_desktop_lines"/>
                        <attribute name="truncate_mobile" source="truncate_mobile"/>
                        <attribute name="truncate_mobile_lines" source="truncate_mobile_lines"/>
                        <html name="content" preview_converter="Magento_PageBuilder/js/converter/html/directive"/>
                        <css name="css_classes"/>
                    </element>
                </elements>
            </appearance>
        </appearances>
        <additional_data>
            <item name="wysiwygConfig" xsi:type="array">
                <item name="wysiwygConfigData" xsi:type="object">Magento\PageBuilder\Model\Config\ContentType\AdditionalData\Provider\Wysiwyg\Config</item>
            </item>
        </additional_data>
    </type>
</config>
