<?xml version="1.0"?>
<!--
/**
 * @category  Scandiweb
 * @package   Scandiweb_ContentTypes
 * @copyright Copyright (c) 2025 Scandiweb, Inc (https://scandiweb.com)
 * @license   http://opensource.org/licenses/OSL-3.0 The Open Software License 3.0 (OSL-3.0)
 */
 -->
<config xmlns:xsi="http://www.w3.org/2001/XMLSchema-instance"
	xsi:noNamespaceSchemaLocation="urn:magento:module:Magento_PageBuilder:etc/content_type.xsd">
	<type name="scandiweb_featured_categories" label="Featured Categories"
		backend_block="Scandiweb\ContentTypes\Block\ContentTypes\FeaturedCategories"
		menu_section="scandiweb_components" component="Magento_PageBuilder/js/content-type"
		preview_component="Scandiweb_ContentTypes/js/content-type/featured-categories/preview"
		master_component="Magento_PageBuilder/js/content-type/master"
		form="pagebuilder_scandiweb_featured_categories_form" sortOrder="4" translate="label">
		<children default_policy="deny" />
		<parents default_policy="allow">
			<parent name="row" policy="allow" />
			<parent name="column" policy="allow" />
			<parent name="tab-item" policy="allow" />
			<parent name="scandiweb_tab_with_image_item" policy="allow" />
		</parents>
		<appearances>
			<appearance name="default" default="true"
				preview_template="Scandiweb_ContentTypes/content-type/featured-categories/default/preview"
				master_template="Scandiweb_ContentTypes/content-type/featured-categories/default/master"
				reader="Magento_PageBuilder/js/master-format/read/configurable">
				<elements>
					<element name="main">
						<attribute name="name" source="data-content-type" />
						<attribute name="appearance" source="data-appearance" />
						<attribute name="appearance_type" source="appearance_type" />
						<attribute name="block_title" source="block_title" />
						<attribute name="block_sub_title" source="block_sub_title" />
						<attribute name="slider_infinitive" source="slider_infinitive" />
						<attribute name="slider_pagination" source="slider_pagination" />
						<attribute name="slider_show_arrows" source="slider_show_arrows" />
						<attribute name="slider_count_mobile" source="slider_count_mobile" />
						<attribute name="slider_count_tablet" source="slider_count_tablet" />
						<attribute name="slider_count_desktop" source="slider_count_desktop" />
						<attribute name="grid_columns_mobile" source="grid_columns_mobile" />
						<attribute name="grid_columns_tablet" source="grid_columns_tablet" />
						<attribute name="grid_columns_desktop" source="grid_columns_desktop" />
						<attribute name="sections" source="data-sections"
							converter="Scandiweb_ContentTypes/js/converter/attribute/object" />
						<html name="html" />
					</element>
				</elements>
				<converters>
					<converter
						component="Scandiweb_ContentTypes/js/content-type/featured-categories/mass-converter/block-directive"
						name="block_directive">
						<config>
							<item name="html_variable" value="html" />
						</config>
					</converter>
				</converters>
			</appearance>
		</appearances>
	</type>
</config>
