<?xml version="1.0"?>
<!--
/**
 * @category  Scandiweb
 * @package   Scandiweb_ContentTypes
 * @copyright Copyright (c) 2025 Scandiweb, Inc (https://scandiweb.com)
 * @license   http://opensource.org/licenses/OSL-3.0 The Open Software License 3.0 (OSL-3.0)
 */
-->
<config xmlns:xsi="http://www.w3.org/2001/XMLSchema-instance" xsi:noNamespaceSchemaLocation="urn:magento:module:Magento_PageBuilder:etc/content_type.xsd">
    <type name="scandiweb_tab_with_image_item"
          label="Tab With Image"
          component="Magento_PageBuilder/js/content-type-collection"
          preview_component="Magento_PageBuilder/js/content-type/tab-item/preview"
          master_component="Magento_PageBuilder/js/content-type/master-collection"
          form="pagebuilder_scandiweb_tab_with_image_item_form"
          menu_section="layout"
          icon="icon-pagebuilder-tabs"
          sortOrder="25"
          translate="label">
        <breakpoints>
            <breakpoint name="mobile">
                <form>pagebuilder_scandiweb_tab_with_image_item_mobile_form</form>
            </breakpoint>
        </breakpoints>
        <parents default_policy="deny">
            <parent name="scandiweb_tabs_with_image" policy="allow"/>
        </parents>
        <children default_policy="allow">
            <child name="row" policy="deny"/>
            <child name="scandiweb_tabs_with_image" policy="deny"/>
        </children>
        <appearances>
            <appearance name="default"
                        default="true"
                        preview_template="Magento_PageBuilder/content-type/tab-item/default/preview"
                        master_template="Magento_PageBuilder/content-type/tab-item/default/master"
                        reader="Magento_PageBuilder/js/master-format/read/configurable">
                <elements>
                    <element name="main">
                        <style name="background_color" source="background_color"/>
                        <style name="background_image" source="background_image" converter="Magento_PageBuilder/js/converter/style/background-image" preview_converter="Magento_PageBuilder/js/converter/style/preview/background-image" persistence_mode="write"/>
                        <style name="background_position" source="background_position"/>
                        <style name="background_size" source="background_size"/>
                        <style name="background_repeat" source="background_repeat"/>
                        <style name="background_attachment" source="background_attachment"/>
                        <style name="text_align" source="text_align"/>
                        <style name="border" source="border_style" converter="Magento_PageBuilder/js/converter/style/border-style"/>
                        <style name="border_color" source="border_color"/>
                        <style name="border_width" source="border_width" converter="Magento_PageBuilder/js/converter/style/remove-px"/>
                        <style name="border_radius" source="border_radius" converter="Magento_PageBuilder/js/converter/style/remove-px"/>
                        <style name="justify_content" source="justify_content" persistence_mode="read"/>
                        <style name="min_height" source="min_height" converter="Magento_PageBuilder/js/converter/style/remove-px"/>
                        <style name="margins" storage_key="margins_and_padding" reader="Magento_PageBuilder/js/property/margins" converter="Magento_PageBuilder/js/converter/style/margins" preview_converter="Magento_PageBuilder/js/content-type/row/converter/style/margins"/>
                        <style name="padding" storage_key="margins_and_padding" reader="Magento_PageBuilder/js/property/paddings" converter="Magento_PageBuilder/js/converter/style/paddings" preview_converter="Magento_PageBuilder/js/content-type/row/converter/style/paddings"/>
                        <attribute name="name" source="data-content-type"/>
                        <attribute name="appearance" source="data-appearance"/>
                        <attribute name="tab_name" source="data-tab-name"/>
                        <attribute name="background_images" source="data-background-images"/>
                        <attribute name="tab_image" source="src" converter="Magento_PageBuilder/js/converter/attribute/src" preview_converter="Magento_PageBuilder/js/converter/attribute/preview/src"/>
                        <css name="css_classes"/>
                    </element>
                    <element name="container">
                        <style name="justify_content" source="justify_content"/>
                        <static_style source="display" value="flex"/>
                        <static_style source="flex_direction" value="column"/>
                    </element>
                </elements>
            </appearance>
        </appearances>
        <is_system>false</is_system>
    </type>
</config>
